{
  "actual_generation": true,
  "attempt_id": "imageattempt_75c830b182fd0b7c79da",
  "credential_lookups": 0,
  "execution_mode": "platform_managed_tool",
  "external_provider_id": null,
  "external_transport_used": false,
  "image_model": "not_exposed_by_tool",
  "output": {
    "completion_timestamp": "2026-07-20T02:51:20.148+09:00",
    "normalized_dimensions": {
      "height": 936,
      "width": 1664
    },
    "normalized_file_size_bytes": 1169529,
    "normalized_format": "PNG",
    "normalized_relative_path": "references/module-002-anchor.png",
    "normalized_sha256": "e0d530dc0b15be88b59d81c7126ce74b8aff4b00def199465801342e6f7ac9de",
    "original_dimensions": {
      "height": 941,
      "width": 1672
    },
    "original_file_size_bytes": 1280468,
    "original_format": "PNG",
    "original_relative_path": "artifacts/module_anchors/imageattempt_75c830b182fd0b7c79da/original.png",
    "original_sha256": "4c3925e2d18ee09044b0519c181d3b517e3788c169934981c8a765ac7280435a",
    "prior_attempt_id": null,
    "prompt_hash": "5793229da516a15ad50c42032728e55b6c7575bf2f1ddd0e59330513f602a755",
    "prompt_id": "prompt_634167014f48e24c3f42",
    "prompt_relative_path": "prompts/module-002.prompt.json",
    "reference_artifacts": [
      {
        "artifact_id": "designboard_61f00a55ee02666b3254",
        "relative_path": "references/design_board.png",
        "sha256": "a0229b8e27b4a103c177682b2d742ae3d4dd6eb9bb70c675cbf9f88293dd666d"
      }
    ],
    "rejection_reason": null,
    "request_timestamp": "2026-07-20T02:50:06.423+09:00",
    "seal_relative_path": "records/attempts/module-002-attempt-001.seal.json",
    "selected": true,
    "target_type": "module_anchor",
    "transformation": {
      "crop_box": [
        4,
        2,
        1668,
        938
      ],
      "nonuniform_resize_used": false,
      "stretch_used": false,
      "type": "aspect_preserving_crop",
      "uniform_resize_to": null
    },
    "verification_status": "VERIFIED",
    "visual_review_status": "ACCEPTED_FOR_PHASE4"
  },
  "platform_tool_channel": "commentary",
  "platform_tool_id": "image_gen.imagegen",
  "platform_tool_invocation_count": 1,
  "record_hash": "f96cd25219639f6fe31eec63d1c0d66d642d5bbf655453c93dd7970f71192c30",
  "record_id": "imageexecution_eacc5e36cec88540fb2a",
  "repository_network_calls": 0,
  "request_id": "imagerequest_53f44536b557fd99fd5f",
  "schema_name": "platform_image_execution_record",
  "schema_version": "1.0.0",
  "target_artifact_id": "moduleanchor_ffa35a3d6def1dfd4394",
  "tool_call_id": "not_exposed"
}
