{
  "actual_generation": true,
  "attempt_id": "imageattempt_e30820b3dbf57f09f410",
  "credential_lookups": 0,
  "execution_mode": "platform_managed_tool",
  "external_provider_id": null,
  "external_transport_used": false,
  "image_model": "not_exposed_by_tool",
  "output": {
    "completion_timestamp": "2026-07-20T03:04:35.803+09:00",
    "normalized_dimensions": {
      "height": 936,
      "width": 1664
    },
    "normalized_file_size_bytes": 762312,
    "normalized_format": "PNG",
    "normalized_relative_path": "visual_targets/slide-002.png",
    "normalized_sha256": "37f42109e03e22d0721da51ffd571e0a78452a5be1447bbcaec4f2d4008c9c72",
    "original_dimensions": {
      "height": 941,
      "width": 1672
    },
    "original_file_size_bytes": 873620,
    "original_format": "PNG",
    "original_relative_path": "artifacts/slide_targets/imageattempt_e30820b3dbf57f09f410/original.png",
    "original_sha256": "1cd0275afccba745cb8b7e4cbdb7e57b4d697f1354d7fdbcd5f849c83c60768c",
    "prior_attempt_id": "imageattempt_70fe3aaea04afdff1d5f",
    "prompt_hash": "d3e8a8f23fe5e6d51ece0cbea3155d3cf71103f110b918a3897ecb9cee95dfa6",
    "prompt_id": "prompt_3399759c7182bb1a4def",
    "prompt_relative_path": "prompts/slide-002.prompt.json",
    "reference_artifacts": [
      {
        "artifact_id": "designboard_61f00a55ee02666b3254",
        "relative_path": "references/design_board.png",
        "sha256": "a0229b8e27b4a103c177682b2d742ae3d4dd6eb9bb70c675cbf9f88293dd666d"
      },
      {
        "artifact_id": "moduleanchor_3591b43d6cf6fe339284",
        "relative_path": "references/module-001-anchor.png",
        "sha256": "632207323326068436325ea377f0477995de06e6e0de5546483c10e259b74f90"
      },
      {
        "artifact_id": "batchreference_3473bb414e4059c9bdd2",
        "relative_path": "references/batch-001-template-reference.png",
        "sha256": "068c846fed83139b3cf25c5c79524db5a7ed74e6713179855faaf65fc41665f0"
      }
    ],
    "rejection_reason": null,
    "request_timestamp": "2026-07-20T03:03:22.529+09:00",
    "seal_relative_path": "records/attempts/slide-002-attempt-002.seal.json",
    "selected": true,
    "target_type": "slide_visual_target",
    "transformation": {
      "crop_box": [
        4,
        2,
        1668,
        938
      ],
      "nonuniform_resize_used": false,
      "stretch_used": false,
      "type": "aspect_preserving_crop",
      "uniform_resize_to": null
    },
    "verification_status": "VERIFIED",
    "visual_review_status": "ACCEPTED_FOR_PHASE4"
  },
  "platform_tool_channel": "commentary",
  "platform_tool_id": "image_gen.imagegen",
  "platform_tool_invocation_count": 1,
  "record_hash": "24b507b2b912c8e16679c6b6c167674de47701b7753dc160bd613b5d1bdce3df",
  "record_id": "imageexecution_c80ca6d4c460f516a6f6",
  "repository_network_calls": 0,
  "request_id": "imagerequest_f3b0c954c8441d33dfe8",
  "schema_name": "platform_image_execution_record",
  "schema_version": "1.0.0",
  "target_artifact_id": "visualtarget_eb8bc3132476d2929014",
  "tool_call_id": "not_exposed"
}
