{
  "actual_generation": true,
  "attempt_id": "imageattempt_2502b789e69959c27135",
  "credential_lookups": 0,
  "execution_mode": "platform_managed_tool",
  "external_provider_id": null,
  "external_transport_used": false,
  "image_model": "not_exposed_by_tool",
  "output": {
    "completion_timestamp": "2026-07-20T02:49:32.450+09:00",
    "normalized_dimensions": {
      "height": 936,
      "width": 1664
    },
    "normalized_file_size_bytes": 1100231,
    "normalized_format": "PNG",
    "normalized_relative_path": "references/module-001-anchor.png",
    "normalized_sha256": "632207323326068436325ea377f0477995de06e6e0de5546483c10e259b74f90",
    "original_dimensions": {
      "height": 941,
      "width": 1672
    },
    "original_file_size_bytes": 1208905,
    "original_format": "PNG",
    "original_relative_path": "artifacts/module_anchors/imageattempt_2502b789e69959c27135/original.png",
    "original_sha256": "275172816831e8a779d0efca698ebb7b42b7abe40db55a56cff23ac28646d5d3",
    "prior_attempt_id": null,
    "prompt_hash": "95057d1d6f8ec2db2133bac32f35eefdefb92e4f20470eed58a5d1ad88357113",
    "prompt_id": "prompt_c3a48cd8e39b930c5a30",
    "prompt_relative_path": "prompts/module-001.prompt.json",
    "reference_artifacts": [
      {
        "artifact_id": "designboard_61f00a55ee02666b3254",
        "relative_path": "references/design_board.png",
        "sha256": "a0229b8e27b4a103c177682b2d742ae3d4dd6eb9bb70c675cbf9f88293dd666d"
      }
    ],
    "rejection_reason": null,
    "request_timestamp": "2026-07-20T02:48:08.383+09:00",
    "seal_relative_path": "records/attempts/module-001-attempt-001.seal.json",
    "selected": true,
    "target_type": "module_anchor",
    "transformation": {
      "crop_box": [
        4,
        2,
        1668,
        938
      ],
      "nonuniform_resize_used": false,
      "stretch_used": false,
      "type": "aspect_preserving_crop",
      "uniform_resize_to": null
    },
    "verification_status": "VERIFIED",
    "visual_review_status": "ACCEPTED_FOR_PHASE4"
  },
  "platform_tool_channel": "commentary",
  "platform_tool_id": "image_gen.imagegen",
  "platform_tool_invocation_count": 1,
  "record_hash": "2740fdfeaebc693e1036fbb534ef9ecb6498454ca92eee6eaccd7341214b71be",
  "record_id": "imageexecution_65c981e5ebf7e3104ccf",
  "repository_network_calls": 0,
  "request_id": "imagerequest_936343dec5ef85952ae7",
  "schema_name": "platform_image_execution_record",
  "schema_version": "1.0.0",
  "target_artifact_id": "moduleanchor_3591b43d6cf6fe339284",
  "tool_call_id": "not_exposed"
}
