{
  "actual_generation": true,
  "attempt_id": "imageattempt_94c4f9b7fae345cecd3e",
  "credential_lookups": 0,
  "execution_mode": "platform_managed_tool",
  "external_provider_id": null,
  "external_transport_used": false,
  "image_model": "not_exposed_by_tool",
  "output": {
    "completion_timestamp": "2026-07-20T02:53:13.361+09:00",
    "normalized_dimensions": {
      "height": 936,
      "width": 1664
    },
    "normalized_file_size_bytes": 1239240,
    "normalized_format": "PNG",
    "normalized_relative_path": "references/module-003-anchor.png",
    "normalized_sha256": "691b71390310872ff17a2a9a151060805a50a11977662a0cf6f3a834dec3615f",
    "original_dimensions": {
      "height": 941,
      "width": 1672
    },
    "original_file_size_bytes": 1355700,
    "original_format": "PNG",
    "original_relative_path": "artifacts/module_anchors/imageattempt_94c4f9b7fae345cecd3e/original.png",
    "original_sha256": "fa251ad61b2eba36d9d31a17e7a9645dcc7ad403f65c3155a6049bec56f5af78",
    "prior_attempt_id": null,
    "prompt_hash": "ed5c5d92f41dd19859e67c1049d4e93a6876d62e873a6a8700fd305710a3c505",
    "prompt_id": "prompt_5cf80d3c10d1672355d0",
    "prompt_relative_path": "prompts/module-003.prompt.json",
    "reference_artifacts": [
      {
        "artifact_id": "designboard_61f00a55ee02666b3254",
        "relative_path": "references/design_board.png",
        "sha256": "a0229b8e27b4a103c177682b2d742ae3d4dd6eb9bb70c675cbf9f88293dd666d"
      }
    ],
    "rejection_reason": null,
    "request_timestamp": "2026-07-20T02:51:59.926+09:00",
    "seal_relative_path": "records/attempts/module-003-attempt-001.seal.json",
    "selected": true,
    "target_type": "module_anchor",
    "transformation": {
      "crop_box": [
        4,
        2,
        1668,
        938
      ],
      "nonuniform_resize_used": false,
      "stretch_used": false,
      "type": "aspect_preserving_crop",
      "uniform_resize_to": null
    },
    "verification_status": "VERIFIED",
    "visual_review_status": "ACCEPTED_FOR_PHASE4"
  },
  "platform_tool_channel": "commentary",
  "platform_tool_id": "image_gen.imagegen",
  "platform_tool_invocation_count": 1,
  "record_hash": "6d92fe287af015302c69190190d600809b9ce5e0e3789f69a3a014d4d9bb8441",
  "record_id": "imageexecution_158c109ea6e8fe2c48c1",
  "repository_network_calls": 0,
  "request_id": "imagerequest_f6439020d213a1f06bf7",
  "schema_name": "platform_image_execution_record",
  "schema_version": "1.0.0",
  "target_artifact_id": "moduleanchor_aea9b62a3605c1edb24c",
  "tool_call_id": "not_exposed"
}
